{
  "feature": "demo-pay",
  "generated_at": "2026-09-16T11:08:00Z",
  "template": {
    "id": "知识分享",
    "version": "3.32.0"
  },
  "title": "演示支付交付复盘知识分享",
  "sharer": "张三",
  "date": "2026-09-16",
  "audience": "服务端与测试组",
  "lessons": [
    {
      "topic": "属主校验要进接口卡模板",
      "content": "横向越权漏到 P4 才发现的根因是详设接口卡只有权限码没有属主字段；把「属主校验」做成接口卡必填项后，同类的越权缺陷在评审期即可拦截"
    },
    {
      "topic": "ZERO-DF 必须附核查证据",
      "content": "安全角色零发现时只写标题的 ZERO-DF 块曾原样通过人工评审；固化「核查范围+证据锚点+验证方式」三字段后，空壳零发现不再出现"
    },
    {
      "topic": "幂等键选择优先业务语义",
      "content": "支付回调幂等键选 order_no+渠道号而非技术流水号，重试与补单两个场景共用同一幂等语义，避免了重复入账"
    }
  ],
  "zero_results": []
}